{"schema_version":"0.4.0","profile":"layered-depth-2d","completeness_policy":"layered-depth-2d-complete-v1","bounds":{"x":0,"y":0,"width":1280,"height":720},"spawn":{"x":96,"y":470},"baseline_y":470,"layers":["sky","far","mid","gameplay","near","lighting","foreground"],"planes":[{"id":"sky","role":"background.sky","layer":"sky","scroll_ratio":[0,0],"z_index":-70,"blend":"mix","native_size":[320,180],"repeat_size":[320,180],"repeat_enabled":true},{"id":"far","role":"background.far","layer":"far","scroll_ratio":[0.12,0.04],"z_index":-60,"blend":"mix","native_size":[320,180],"repeat_size":[320,180],"repeat_enabled":true},{"id":"mid","role":"background.mid","layer":"mid","scroll_ratio":[0.32,0.12],"z_index":-50,"blend":"mix","native_size":[320,180],"repeat_size":[320,180],"repeat_enabled":true},{"id":"depth-fog","role":"background.depth-fog","layer":"mid","scroll_ratio":[0.45,0.18],"z_index":-40,"blend":"add","native_size":[320,180],"repeat_size":[320,180],"repeat_enabled":true},{"id":"near","role":"near.overlay","layer":"near","scroll_ratio":[0.82,0.42],"z_index":30,"blend":"mix","native_size":[320,180],"repeat_size":[320,180],"repeat_enabled":true},{"id":"ambient-light","role":"lighting.ambient","layer":"lighting","scroll_ratio":[1,1],"z_index":50,"blend":"multiply","native_size":[320,180],"repeat_size":[320,180],"repeat_enabled":true},{"id":"foreground","role":"foreground.overlay","layer":"foreground","scroll_ratio":[1.16,1.08],"z_index":70,"blend":"mix","native_size":[320,180],"repeat_size":[320,180],"repeat_enabled":true}],"placements":[{"id":"entrance","role":"structure.entrance","x":48,"y":390,"layer":"gameplay"},{"id":"npc-guide","role":"character.npc.atlas","x":430,"y":560,"layer":"gameplay"},{"id":"checkpoint","role":"structure.checkpoint","x":680,"y":360,"layer":"gameplay"},{"id":"collectible","role":"collectible.primary","x":824,"y":500,"layer":"gameplay"},{"id":"landmark","role":"structure.landmark","x":930,"y":320,"layer":"gameplay"},{"id":"local-light","role":"lighting.local","x":960,"y":390,"layer":"lighting"},{"id":"exit","role":"structure.exit","x":1184,"y":440,"layer":"gameplay"}]}
